{
  "$schema": "http://json-schema.org/draft-07/schema#",
  "$comment": "Schema per F3 STEP 6 (aprile 2026). Descrive la struttura dell'output di stabilizzazione del proxy decisivo: diagnosi del proxy originale, scomposizione strutturale, costruzione del nuovo proxy, test di non-reversibilità, verifica di ancoraggio.",
  "title": "ProxyStabilizationOutput",
  "description": "Output di F3 STEP 6: stabilizzazione del proxy decisivo. Il proxy originale viene analizzato, decomposto e ricostruito in forma epistemicamente più robusta: non circolare, non reversibile, ancorato a osservabili della case_description.",

  "type": "object",
  "required": ["step", "theme_id", "domain", "source_output_id", "target_proxy", "original_proxy_issues", "new_proxy", "non_reversibility_test", "anchor_check", "final_assessment"],
  "properties": {

    "step": {
      "type": "string",
      "const": "f3_step_6",
      "description": "Identificatore dello step di pipeline. Valore fisso."
    },

    "theme_id": {
      "type": "string",
      "description": "ID del tema, coerente con gli step precedenti."
    },

    "domain": {
      "type": "string",
      "description": "Dominio professionale di applicazione del dispositivo."
    },

    "source_output_id": {
      "type": "string",
      "description": "Identificatore dell'output F3 STEP 5 (audit) che ha motivato questa stabilizzazione."
    },

    "target_proxy": {
      "type": "string",
      "description": "Formulazione del proxy originale che viene sottoposto a stabilizzazione."
    },

    "original_proxy_issues": {
      "type": "object",
      "description": "Analisi dei problemi strutturali del proxy originale.",
      "required": ["reversibility", "circularity", "non_observability"],
      "properties": {
        "reversibility": {
          "type": "string",
          "description": "Perché il proxy originale è reversibile — come può essere letto in entrambe le direzioni classificatorie."
        },
        "circularity": {
          "type": "string",
          "description": "Dove il proxy perde ancoraggio fenomenico e dipende dalla observed_configuration invece che dalla case_description."
        },
        "non_observability": {
          "type": "string",
          "description": "In quali condizioni di applicazione il proxy non è osservabile o richiede inferenze non controllabili."
        }
      }
    },

    "structural_decomposition": {
      "type": "object",
      "description": "Scomposizione dell'episodio in sequenza osservabile. Facoltativo ma raccomandato quando la diagnosi rivela che il proxy originale non cattura la struttura temporale dell'interazione.",
      "properties": {
        "notes": { "type": "string" },
        "sequence": {
          "type": "array",
          "items": { "type": "string" }
        },
        "observation": { "type": "string" }
      }
    },

    "new_proxy": {
      "type": "object",
      "description": "Il nuovo proxy costruito in sostituzione o affiancamento del proxy originale.",
      "required": ["name", "observable_sequence", "discriminating_element"],
      "properties": {
        "name": {
          "type": "string",
          "description": "Nome sintetico del nuovo proxy."
        },
        "structure": {
          "type": "string",
          "description": "Descrizione della struttura relazionale o temporale che il proxy cattura."
        },
        "rationale": {
          "type": "string",
          "description": "Giustificazione strutturale del nuovo proxy — perché è meno reversibile e meno circolare."
        },
        "observable_sequence": {
          "type": "array",
          "description": "Sequenza di elementi osservabili che compongono il proxy.",
          "minItems": 1,
          "items": { "type": "string" }
        },
        "discriminating_element": {
          "type": "string",
          "description": "L'elemento specifico che discrimina tra le due classificazioni."
        },
        "anchor_requirement": {
          "type": "string",
          "description": "Quale informazione specifica deve essere presente nella case_description per applicare il proxy. Dichiarato esplicitamente quando il proxy introduce requisiti osservativi non coperti dalle descrizioni standard."
        }
      }
    },

    "non_reversibility_test": {
      "type": "object",
      "description": "Test obbligatorio di non-reversibilità del nuovo proxy.",
      "required": ["counter_reading", "rebuttal", "result"],
      "properties": {
        "counter_reading": {
          "type": "string",
          "description": "Contro-lettura forte: come il nuovo proxy potrebbe essere letto in direzione opposta."
        },
        "rebuttal": {
          "type": "string",
          "description": "Risposta alla contro-lettura: perché il proxy resiste strutturalmente."
        },
        "result": {
          "type": "string",
          "enum": ["resiste", "parzialmente_resistente", "non_resiste"],
          "description": "Esito del test. resiste: la contro-lettura non regge. parzialmente_resistente: il proxy resiste ma con condizioni esplicitate. non_resiste: il proxy deve essere modificato o affiancato."
        },
        "result_notes": {
          "type": "string",
          "description": "Qualificazione dell'esito — specifica le condizioni che rendono il proxy parzialmente resistente o i motivi per cui non resiste."
        }
      }
    },

    "anchor_check": {
      "type": "array",
      "description": "Verifica dell'ancoraggio per ciascun elemento del proxy. Per ogni elemento deve essere dichiarata la fonte e il grado di dipendenza dall'osservatore.",
      "minItems": 1,
      "items": { "$ref": "#/definitions/AnchorCheckItem" }
    },

    "case_description_gap": {
      "type": "object",
      "description": "Facoltativo. Dichiara esplicitamente quale informazione manca nelle case_description correnti per rendere il proxy applicabile. Obbligatorio se il proxy introduce requisiti osservativi non coperti dalle descrizioni esistenti.",
      "properties": {
        "missing_in_current_descriptions": { "type": "string" },
        "required_formulation_open": { "type": "string" },
        "required_formulation_predetermined": { "type": "string" }
      }
    },

    "final_assessment": {
      "type": "object",
      "description": "Valutazione finale della stabilizzazione raggiunta.",
      "required": ["is_more_robust"],
      "properties": {
        "is_more_robust": {
          "type": "boolean",
          "description": "Il nuovo proxy è strutturalmente più robusto del proxy originale."
        },
        "robustness_improvement": {
          "type": "string",
          "description": "Descrizione del miglioramento di robustezza. Obbligatorio se is_more_robust è true."
        },
        "remaining_weakness": {
          "type": "string",
          "description": "Debolezza strutturale residua. Obbligatorio se is_more_robust è false o se ci sono limitazioni condizionali."
        },
        "failure_declared": {
          "type": "boolean",
          "description": "Se il proxy non ha raggiunto le condizioni di accettabilità, dichiarare FALLIMENTO esplicitamente."
        },
        "failure_reason": {
          "type": "string",
          "description": "Motivo del fallimento. Obbligatorio se failure_declared è true."
        }
      }
    }

  },

  "definitions": {

    "AnchorCheckItem": {
      "type": "object",
      "required": ["element", "source", "observer_dependency"],
      "properties": {
        "element": {
          "type": "string",
          "description": "Elemento del proxy di cui si verifica l'ancoraggio."
        },
        "source": {
          "type": "string",
          "enum": ["case_description", "osservabile", "observed_configuration", "inferenza_esterna"],
          "description": "Fonte dell'ancoraggio. Se observed_configuration o inferenza_esterna, il proxy ha rischio di circolarità."
        },
        "evidence": {
          "type": "string",
          "description": "Citazione o riferimento preciso all'elemento che supporta il proxy. Obbligatorio se source è case_description."
        },
        "observer_dependency": {
          "type": "string",
          "enum": ["bassa", "media", "alta"],
          "description": "Grado di dipendenza dall'interpretazione dell'osservatore."
        },
        "notes": {
          "type": "string",
          "description": "Note aggiuntive — in particolare se l'elemento è discriminante o uguale in entrambe le configurazioni."
        }
      }
    }

  }
}
