{
  "step": "f3_step_6",
  "theme_id": "tema_07_ecosistema_digitale",
  "domain": "educativo (servizi per la prima infanzia, 0–6)",
  "source_output_id": "stabilizzazione-proxy-v1b",
  "target_proxy": "Registrazione come partecipazione: qualità ascendente-interrogativa della vocalizzazione finale dell'educatore come marcatore della funzione partecipativa rispetto alla funzione registrativa o chiudente della co-regolazione.",
  "original_proxy_issues": {
    "reversibility": "L'intonazione ascendente-interrogativa è reversibile per costituzione fonetica e relazionale. Una stessa formula ('che bella pigna hai trovato?') può operare come (a) vera apertura interrogativa che invita il bambino a estendere il campo aperto dal gesto, oppure come (b) chiusura performativa in cui la forma interrogativa marca la presa d'atto e prelude all'inserimento del momento dentro la grammatica della restituzione (documentazione, narrazione alla famiglia, indicatore di qualità della rete). Nella forma chiudente, l'intonazione ascendente non testimonia partecipazione ma realizza la registrazione in modalità dialogica. Le due letture sono indistinguibili sul solo piano della qualità intonativa, e la distorsione invertita (la grammatica della prestazionalizzazione che si rovescia in marcatori anti-performativi) può precisamente colonizzare la forma interrogativa-aperta come lessico identitario di qualità della mediazione. La reversibilità non è eliminabile a livello del singolo evento vocale.",
    "circularity": "Il proxy 'qualità ascendente-interrogativa' richiede, per essere classificato come marcatore di funzione partecipativa, di sapere già che la situazione è partecipativa: la qualità dell'intonazione viene riconosciuta come 'autentica' o 'performativa' a partire dalla classificazione complessiva della scena, non viceversa. Nei casi reali, la lettura prosodica attinge alla observed_configuration (la sensazione complessiva del momento) per qualificarsi come ascendente-genuina o ascendente-chiudente. Il proxy quindi non deriva strutturalmente dalla case_description ma dall'esito già implicito nella ricostruzione della scena: l'osservatore sente l'intonazione come aperta perché ha già letto la scena come aperta, e classifica la scena come aperta perché ha sentito l'intonazione come aperta. Questa circolarità è invisibile al proxy stesso e lo rende un dispositivo di conferma, non di discriminazione.",
    "non_observability": "La qualità intonativa non è registrata come dato fattuale nelle case_description standard del dominio educativo: le descrizioni riportano il contenuto delle parole ('l'educatrice dice: che bella pigna hai trovato'), non la curva prosodica. La ricostruzione a posteriori della qualità intonativa è inferenziale e dipende dalla competenza prosodica dell'osservatore, che ha alta dipendenza dalla sensibilità individuale e dal contesto interpretativo. Inoltre, la classificazione fine tra 'ascendente-genuina' e 'ascendente-performativa' non corrisponde a un parametro fonetico isolabile: è una qualità gestaltica della voce in contesto, e quindi non è né direttamente osservabile né osservabile con mediazione tecnica univoca (un'analisi acustica del contorno F0 non discrimina tra le due forme funzionali)."
  },
  "structural_decomposition": {
    "notes": "L'episodio della co-regolazione tra educatore e bambino non si gioca nel singolo evento vocale (R_e) ma nella catena temporale che si dispiega dopo R_e. La distinzione strutturale tra funzione partecipativa e funzione registrativa o chiudente non è leggibile sul punto della risposta verbale: è leggibile sulla forma della sequenza che segue, e in particolare sulla compatibilità tra la sospensione, l'orientamento corporeo dell'educatore, la persistenza del bambino e la natura dell'azione successiva.",
    "sequence": [
      "G_b — Gesto o apertura del bambino verso l'educatore o verso il campo del desiderabile (es. mostra un materiale all'educatrice, vocalizza, indica, porge un oggetto).",
      "R_e — Prima risposta verbale dell'educatore al gesto del bambino (la formula in cui originariamente si misurava la qualità intonativa).",
      "T_susp — Durata della sospensione immediatamente successiva a R_e: silenzio dell'educatore o sua continuazione non sostitutiva (assenza di nuovo materiale verbale o di nuova azione introdotta).",
      "C_e — Comportamento corporeo dell'educatore durante T_susp: orientamento del corpo e dello sguardo verso il campo aperto da G_b (verso il materiale, verso il bambino come polo del campo) oppure riposizionamento (verso documentazione, verso un altro adulto, verso un altro bambino, verso un'altra attività).",
      "P_b — Comportamento del bambino durante T_susp: persistenza nello stesso registro di gesti aperto da G_b (continua a manipolare lo stesso materiale, mantiene la postura, vocalizza nello stesso registro) oppure cambio di attività o di oggetto.",
      "S_e — Successiva azione dell'educatore dopo T_susp: estensione del campo aperto da G_b (gesto o parola che apre nuovi piani sullo stesso campo, senza introdurre uno script disponibile) oppure introduzione di un nuovo elemento (narrazione strutturata, ripresa dell'attività organizzata, documentazione, transizione, restituzione)."
    ],
    "observation": "La qualità intonativa di R_e diventa irrilevante per la discriminazione: una stessa formula intonativamente ascendente può preludere a una sospensione co-tenuta o a una chiusura immediata in script di restituzione. La discriminazione si gioca sulla composizione di T_susp, C_e, P_b e S_e, non sulla curva prosodica di R_e. Il piano vocale viene così sostituito dal piano della struttura temporale e corporea della catena, che è leggibile dalla case_description in forma fattuale e non prosodica."
  },
  "new_proxy": {
    "name": "Forma della catena post-risposta dell'educatore: sospensione co-tenuta del campo aperto dal bambino vs chiusura immediata in script di restituzione/documentazione",
    "structure": "Il proxy cattura la struttura temporale e corporea della co-regolazione nei secondi immediatamente successivi alla risposta verbale dell'educatore al gesto del bambino. Discrimina tra una funzione partecipativa (sospensione mantenuta + corpo orientato + persistenza del bambino + azione successiva come estensione del campo) e una funzione registrativa o chiudente (assenza di sospensione o sospensione accompagnata da riposizionamento + introduzione di nuovo elemento o cambio di attività del bambino). Il proxy opera al livello della forma della catena, non al livello della funzione 'autentica' della partecipazione, e dichiara esplicitamente la sua zona di indistinguibilità rispetto alla distorsione invertita di alto grado.",
    "rationale": "Il proxy è strutturalmente meno reversibile per quattro ragioni cumulative. PRIMA: sostituisce la qualità intonativa (un parametro gestaltico ad alta dipendenza dall'osservatore e non registrato nelle case_description) con quattro osservabili compositi (T_susp, C_e, P_b, S_e), nessuno dei quali richiede competenza prosodica. SECONDA: è composito per costruzione, nessun singolo elemento discrimina (un silenzio può essere disengagement, un orientamento corporeo può essere documentazione visiva, una persistenza del bambino può essere ostinazione indipendente dalla co-regolazione); è la simultaneità della triangolazione a discriminare, e questo rende il proxy resistente alle imitazioni puntuali. TERZA: include S_e (l'azione successiva alla sospensione) per intercettare la chiusura registrativa differita: la performance anti-performativa che imita i primi tre elementi deve comunque manifestare la chiusura nell'azione successiva, attraverso l'introduzione di un elemento sostitutivo del campo aperto. QUARTA: nessuno degli osservabili dipende dalla observed_configuration o dalla classificazione finale; ciascuno è leggibile a partire dalla case_description senza conoscere l'esito, e l'omissione anche di uno solo produce esito 'non_classificabile' invece di classificazione forzata.",
    "observable_sequence": [
      "Identificazione di un episodio in cui il bambino apre il campo del desiderabile con un gesto verso l'educatore (G_b) e l'educatore risponde verbalmente (R_e). Questi due eventi sono richiesti come condizione di applicabilità ma non sono discriminanti.",
      "Registrazione, nei secondi successivi a R_e, della presenza o assenza di sospensione (T_susp): l'educatore tace o continua senza introdurre nuovi elementi, oppure introduce immediatamente un nuovo elemento (commento di restituzione, documentazione, riposizionamento dell'attività, narrazione al gruppo, transizione).",
      "Registrazione del comportamento corporeo dell'educatore durante T_susp se presente (C_e): corpo orientato verso il campo aperto da G_b (verso il materiale del bambino, verso il bambino come polo del campo, sguardo nello stesso campo del gesto), oppure riposizionamento (corpo o sguardo che si volta verso documentazione, taccuino, telefono, altro adulto, altro bambino, altra attività).",
      "Registrazione del comportamento del bambino durante T_susp se presente (P_b): persistenza nello stesso registro di gesti aperto da G_b (continua a manipolare lo stesso materiale, mantiene la postura, vocalizza nello stesso registro), oppure cambio di attività o di oggetto.",
      "Registrazione dell'azione successiva dell'educatore dopo T_susp (S_e): estensione del campo aperto da G_b (gesto o parola che continua sullo stesso piano del campo aperto, senza introdurre uno script disponibile), oppure introduzione di un nuovo elemento (narrazione strutturata, ripresa dell'attività organizzata, documentazione, transizione, restituzione anche in forma narrativa o riflessiva).",